{
  "schema_version": "1.0",
  "kind": "architecture_blueprint",
  "id": "enterprise-capability-map",
  "version": "0.1.0",
  "name": "Enterprise capability map",
  "purpose": "Connect a business capability, service, application and accountable team.",
  "scope": {
    "included": [
      "capability",
      "service",
      "application",
      "team"
    ],
    "excluded": [
      "Provider credentials",
      "Runtime records and personal data"
    ]
  },
  "nodes": [
    {
      "key": "capability",
      "type": "capability",
      "name": "Capability"
    },
    {
      "key": "service",
      "type": "service",
      "name": "Service"
    },
    {
      "key": "application",
      "type": "application",
      "name": "Application"
    },
    {
      "key": "team",
      "type": "team",
      "name": "Team"
    }
  ],
  "relationships": [
    {
      "source": "service",
      "type": "service_implements_capability",
      "target": "capability"
    },
    {
      "source": "application",
      "type": "application_supports_service",
      "target": "service"
    },
    {
      "source": "application",
      "type": "application_owned_by_team",
      "target": "team"
    }
  ],
  "viewpoints": [
    "capability_map",
    "enterprise_landscape"
  ],
  "decisions": [
    {
      "id": "deployment-target",
      "status": "open",
      "question": "Which runtime and quality constraints fit this architecture?"
    }
  ],
  "constraints": [
    "Confirm component identity before merging with an existing workspace.",
    "A model does not grant runtime permissions."
  ],
  "gaps": [],
  "deployable": false
}
